{
  "schemaVersion": 1,
  "recordedAt": "2026-08-26T10:42:24Z",
  "plan": "docs/execution/plans/2026-08-26-portable-durable-web-agent-plan.md",
  "taskId": "S1-T01",
  "candidateRevision": "2d372194d197e54ab2553c640f7c50be0ba5798c",
  "worktree": {
    "branch": "main",
    "upstream": "origin/main",
    "ahead": 1,
    "behind": 0,
    "status": "clean"
  },
  "environment": {
    "node": "v25.6.0",
    "npm": "11.8.0",
    "workspaceCount": 9,
    "architectureIntegrationTestCountBeforeReconciliation": 71
  },
  "commands": [
    {
      "command": "npm run check",
      "exitStatus": 0,
      "result": "format、lint、typecheck、9-workspace boundary 与 v0.2 coverage check 通过"
    },
    {
      "command": "npm run test:unit",
      "exitStatus": 0,
      "result": "7 files、101 tests passed"
    },
    {
      "command": "npm run test:contracts",
      "exitStatus": 0,
      "result": "5 files、69 tests passed"
    },
    {
      "command": "npm run test:integration",
      "exitStatus": 0,
      "result": "14 files、74 tests passed"
    },
    {
      "command": "npm run test:e2e",
      "exitStatus": 0,
      "result": "1 file、3 tests passed"
    },
    {
      "command": "npm run check:pi-compat",
      "exitStatus": 0,
      "result": "1 file、6 tests passed"
    },
    {
      "command": "python3 /Users/triggerjames/.codex/skills/document-governance/scripts/validate_docs.py --strict .",
      "exitStatus": 0,
      "result": "Document governance validation passed: 0 warning(s)."
    }
  ],
  "verificationSummary": [
    "S1-A01–S1-A09 已在 v0.2 coverage manifest 中绑定 Plan tasks、预期证据和验证入口。",
    "当前 9 个 workspace 仍是 Foundation 边界，S1 新增 adapters/apps 尚未建立。",
    "main 相对 origin/main ahead 1、behind 0；干净工作树不被当作远端同步证明。",
    "Architecture 的 integration test 数量从 71 漂移到 74，已在同一变更中对账。"
  ],
  "unverified": [
    "better-sqlite3、Mem0、HTTP/JWT、Web UI、GitHub App 与密码学依赖尚未完成版本匹配 preflight。",
    "Mac/Hermes 原生兼容、真实 SQLite、Mem0、浏览器、模型、外部账户与迁移均未验证。"
  ],
  "externalEffects": [],
  "implementationCommit": null
}
